{
  "contract_version": "1.0.0",
  "gate": "6B",
  "search_space_id": "gate_6b_lightgbm_l1_1.0.0",
  "candidate_family": "advanced_tabular",
  "algorithm_id": "lightgbm_l1",
  "data_boundary": {
    "admissible_partitions": ["training", "validation"],
    "locked_test_access_permitted": false,
    "fold_strategy": "nested_expanding_window",
    "outer_fold_count": 4,
    "inner_fold_count": 3,
    "purge_intervals": 4
  },
  "parameter_space": [
    {"name": "n_estimators", "type": "integer", "required": true, "minimum": 200, "maximum": 400, "step": 50},
    {"name": "learning_rate", "type": "number", "required": true, "minimum": 0.02, "maximum": 0.05, "step": 0.01, "log_scale": false},
    {"name": "num_leaves", "type": "integer", "required": true, "minimum": 31, "maximum": 63, "step": 32},
    {"name": "min_child_samples", "type": "integer", "required": true, "minimum": 20, "maximum": 80, "step": 20},
    {"name": "subsample", "type": "number", "required": true, "minimum": 0.9, "maximum": 1.0, "step": 0.1, "log_scale": false},
    {"name": "colsample_bytree", "type": "number", "required": true, "minimum": 0.8, "maximum": 1.0, "step": 0.1, "log_scale": false},
    {"name": "reg_lambda", "type": "number", "required": true, "minimum": 1.0, "maximum": 10.0, "step": 1.0, "log_scale": true},
    {"name": "reg_alpha", "type": "number", "required": true, "minimum": 0.0, "maximum": 0.1, "step": 0.1, "log_scale": false}
  ],
  "budget": {
    "max_unique_trials": 4,
    "max_parallel_trials": 1,
    "max_retries_per_trial": 1,
    "max_wall_clock_minutes": 120
  },
  "seeds": [20260725],
  "objectives": ["aggregate_mae", "peak_state_mae", "temporal_fold_dispersion", "model_size_bytes", "p95_inference_latency_ms_per_1000_rows", "portability_failure_count"],
  "hard_constraints": ["chronology_violation_count", "leakage_violation_count", "locked_test_access_count", "missing_required_artifact_count", "nonfinite_objective_count", "portability_failure_count", "ungoverned_parameter_count"],
  "provenance": {
    "optimization_contract_version": "1.0.0",
    "code_commit": "f814d022d46a61ede616d6b15da749b7c9f42142",
    "created_by_role": "human",
    "human_approved": true,
    "approved_before_execution": true
  }
}
