{
  "contract_version": "1.0.0",
  "gate": "6B",
  "search_space_id": "gate_6b_catboost_mae_1.0.0",
  "candidate_family": "advanced_tabular",
  "algorithm_id": "catboost_mae",
  "data_boundary": {
    "admissible_partitions": ["training", "validation"],
    "locked_test_access_permitted": false,
    "fold_strategy": "nested_expanding_window",
    "outer_fold_count": 4,
    "inner_fold_count": 3,
    "purge_intervals": 4
  },
  "parameter_space": [
    {"name": "iterations", "type": "integer", "required": true, "minimum": 200, "maximum": 400, "step": 50},
    {"name": "learning_rate", "type": "number", "required": true, "minimum": 0.02, "maximum": 0.05, "step": 0.01, "log_scale": false},
    {"name": "depth", "type": "integer", "required": true, "minimum": 6, "maximum": 8, "step": 1},
    {"name": "l2_leaf_reg", "type": "number", "required": true, "minimum": 3.0, "maximum": 10.0, "step": 1.0, "log_scale": true},
    {"name": "random_strength", "type": "number", "required": true, "minimum": 0.0, "maximum": 0.5, "step": 0.5, "log_scale": false}
  ],
  "budget": {
    "max_unique_trials": 4,
    "max_parallel_trials": 1,
    "max_retries_per_trial": 1,
    "max_wall_clock_minutes": 120
  },
  "seeds": [20260725],
  "objectives": ["aggregate_mae", "peak_state_mae", "temporal_fold_dispersion", "model_size_bytes", "p95_inference_latency_ms_per_1000_rows", "portability_failure_count"],
  "hard_constraints": ["chronology_violation_count", "leakage_violation_count", "locked_test_access_count", "missing_required_artifact_count", "nonfinite_objective_count", "portability_failure_count", "ungoverned_parameter_count"],
  "provenance": {
    "optimization_contract_version": "1.0.0",
    "code_commit": "720b1799420f9e03b1d4123a8267ffa901f29268",
    "created_by_role": "human",
    "human_approved": true,
    "approved_before_execution": true
  }
}
